{
  "schema_version": 1,
  "id": "image/sdxl/icon-asset-structure-appearance-lora",
  "version": "0.1.1",
  "title": "圖示素材（SDXL、結構參考、外觀參考、LoRA）",
  "summary": "圖示素材（SDXL、結構參考、外觀參考、LoRA）。固定 API graph，runner 只填 slot。",
  "status": "draft",
  "status_note": "尚未實機執行。windows-cuda 與 macos-mps 都是 untested。",
  "min_comfyui_version": "0.34.0",
  "requires_custom_nodes": [
    {
      "id": "comfyui_ipadapter_plus",
      "source": "registry"
    }
  ],
  "graph": {
    "file": "graph.api.json",
    "format": "comfyui-api",
    "sha256": "ed422b7802d2fcf2d817b112d25b15de7311a0f70a7525156170f5160222157b",
    "canonical_sha256": "9383fc89544979055ea378a5153f30f26f538446a19cca87bc8ed1795c4b7974"
  },
  "provenance": {
    "derived_from": "comfyui_pipeline.image_graphs.build_icon_asset；離線產生器 tools_src/maintenance/build_image_templates.py",
    "upstream": {
      "kind": "none",
      "name": null,
      "blob": null,
      "comfyui_version": null,
      "note": "graph 由 image_graphs builder 產生，不是從官方 workflow template 派生。ComfyUI 0.34.0 內建的官方範本是 UI workflow，對不上這份 API graph，所以 kind 是 none。"
    },
    "tested_source_sha256": null,
    "evidence": [
      {
        "path": "tools_src/comfyui_pipeline/image_graphs.py",
        "note": "graph 原本的 Python builder（2026-10-09 已移除，templates/ 為唯一來源）"
      },
      {
        "path": "tests/fixtures/image_graphs_golden/sdxl.json",
        "note": "圖片 golden graph"
      },
      {
        "path": "docs/knowledge/decisions/2026-10-08-image-template-variants.md",
        "note": "方案 A 與家族對應的決定"
      }
    ]
  },
  "slots": {
    "prompt": {
      "type": "text",
      "targets": [
        {
          "node": "2",
          "input": "text",
          "placeholder": "__PROMPT__"
        }
      ],
      "required": true,
      "validate": {
        "min_length": 1
      },
      "help": "正向提示詞，要含圖示後綴「, single centered object, icon design, isolated on plain simple background, clean readable silhouette, no scene, no extra props」。generate.py 會把後綴接在整段文字後面，slot 無法只替換前半段。"
    },
    "negative": {
      "type": "text",
      "targets": [
        {
          "node": "3",
          "input": "text"
        }
      ],
      "default": "blurry, low quality, extra fingers, deformed, watermark, cluttered scene, multiple objects, full illustration background, cropped edges",
      "help": "負向提示詞。預設已含圖示負向後綴。"
    },
    "seed": {
      "type": "seed",
      "targets": [
        {
          "node": "5",
          "input": "seed"
        }
      ],
      "default": "auto",
      "help": "亂數種子。auto 由 runner 抽一個非負整數。"
    },
    "steps": {
      "type": "int",
      "targets": [
        {
          "node": "5",
          "input": "steps"
        }
      ],
      "default": 25,
      "validate": {
        "min": 1,
        "max": 150
      },
      "help": "KSampler 步數"
    },
    "cfg": {
      "type": "float",
      "targets": [
        {
          "node": "5",
          "input": "cfg"
        }
      ],
      "default": 7.0,
      "validate": {
        "min": 0,
        "max": 30
      },
      "help": "KSampler CFG"
    },
    "checkpoint": {
      "type": "string",
      "targets": [
        {
          "node": "1",
          "input": "ckpt_name"
        }
      ],
      "default": "sd_xl_base_1.0.safetensors",
      "help": "底模檔名。預設是這個家族的底模；--style 換檔時由呼叫端傳入。"
    },
    "lora_name": {
      "type": "string",
      "targets": [
        {
          "node": "1b",
          "input": "lora_name",
          "placeholder": "__LORA_NAME__"
        }
      ],
      "required": true,
      "help": "LoRA 檔名。使用者自備，不進 models pin。"
    },
    "lora_strength": {
      "type": "float",
      "targets": [
        {
          "node": "1b",
          "input": "strength_model"
        },
        {
          "node": "1b",
          "input": "strength_clip"
        }
      ],
      "default": 0.8,
      "validate": {
        "min": 0,
        "max": 1
      },
      "help": "LoRA 強度，同時寫入 strength_model 與 strength_clip"
    },
    "control_strength": {
      "type": "float",
      "targets": [
        {
          "node": "4e",
          "input": "strength"
        }
      ],
      "default": 0.85,
      "validate": {
        "min": 0,
        "max": 1
      },
      "help": "ControlNet 強度"
    },
    "appearance_weight": {
      "type": "float",
      "targets": [
        {
          "node": "1b5",
          "input": "weight"
        }
      ],
      "default": 0.8,
      "validate": {
        "min": 0,
        "max": 1
      },
      "help": "IPAdapter 權重"
    },
    "structure_ref": {
      "type": "image",
      "targets": [
        {
          "node": "4",
          "input": "image",
          "placeholder": "__STRUCTURE_REF__"
        }
      ],
      "upload": true,
      "required": true,
      "help": "圖示結構參考圖"
    },
    "appearance_ref": {
      "type": "image",
      "targets": [
        {
          "node": "1b2",
          "input": "image",
          "placeholder": "__APPEARANCE_REF__"
        }
      ],
      "upload": true,
      "required": true,
      "help": "外觀參考圖"
    },
    "filename_prefix": {
      "type": "string",
      "targets": [
        {
          "node": "7",
          "input": "filename_prefix"
        }
      ],
      "default": "icon_asset",
      "help": "存檔前綴，預設是固定前綴。不用 output_prefix，避免被改成 gameart/..."
    }
  },
  "options": {},
  "fixed_notes": "filename_prefix 維持固定前綴，不用 output_prefix。tier 只影響呼叫端傳入的寬高；template 預設是家族原生尺寸。LoRA 檔由呼叫端傳入，不進 models pin。prompt 要傳入已含圖示後綴的完整文字；negative 預設已含圖示負向後綴。",
  "pre": [
    {
      "step": "upload",
      "slots": [
        "structure_ref",
        "appearance_ref"
      ]
    }
  ],
  "post": [],
  "frame_anchoring": {
    "first": "none",
    "last": "none",
    "reference_role": "none",
    "time_alignment": null,
    "continuity": null
  },
  "models": [
    {
      "role": "checkpoint",
      "node": "1",
      "input": "ckpt_name",
      "filename": "sd_xl_base_1.0.safetensors",
      "path": "models/checkpoints/sd_xl_base_1.0.safetensors",
      "directory": "checkpoints",
      "size_bytes": 6938078334,
      "sha256": "31e35c80fc4829d14f90153f4c74cd59c90b779f6afe05a74cd6120b893f7e5b",
      "source": null,
      "url": null
    },
    {
      "role": "clip_vision",
      "node": "1b3",
      "input": "clip_name",
      "filename": "CLIP-ViT-H-14-laion2B-s32B-b79K.safetensors",
      "path": "models/clip_vision/CLIP-ViT-H-14-laion2B-s32B-b79K.safetensors",
      "directory": "clip_vision",
      "size_bytes": 2528373448,
      "sha256": "6ca9667da1ca9e0b0f75e46bb030f7e011f44f86cbfb8d5a36590fcd7507b030",
      "source": null,
      "url": null
    },
    {
      "role": "ipadapter",
      "node": "1b4",
      "input": "ipadapter_file",
      "filename": "ip-adapter-plus_sdxl_vit-h.safetensors",
      "path": "models/ipadapter/ip-adapter-plus_sdxl_vit-h.safetensors",
      "directory": "ipadapter",
      "size_bytes": 847517512,
      "sha256": "3f5062b8400c94b7159665b21ba5c62acdcd7682262743d7f2aefedef00e6581",
      "source": null,
      "url": null
    },
    {
      "role": "controlnet",
      "node": "4d",
      "input": "control_net_name",
      "filename": "controlnet-canny-sdxl-1.0.safetensors",
      "path": "models/controlnet/controlnet-canny-sdxl-1.0.safetensors",
      "directory": "controlnet",
      "size_bytes": 2502139104,
      "sha256": "80664d80e3f233371cb6921110d0a6b7a40c01571905463f9dde5637e7894ed3",
      "source": null,
      "url": null
    }
  ],
  "capability_gate": {
    "nodes": "from_graph",
    "selectors": "from_models",
    "files": "from_models",
    "extra_nodes": [],
    "platforms": {
      "windows-cuda": {
        "status": "untested"
      },
      "macos-mps": {
        "status": "untested"
      }
    },
    "min_memory_mb": null,
    "capability": "image_generation"
  },
  "outputs": [
    {
      "id": "image",
      "node": "7",
      "kind": "image",
      "role": "candidate"
    }
  ]
}
